{
  "schemaVersion": "1.0.0",
  "presetId": "military",
  "generation": "military@sha256:f27cf981c025cac821723f7987ab0398709ff46ebb7f96883b2bd964ef835cf7",
  "assetHash": "f27cf981c025cac821723f7987ab0398709ff46ebb7f96883b2bd964ef835cf7",
  "bundleVersion": "0.9.0-alpha.13",
  "dshBaseline": {
    "release": "0.1.1-rc.2",
    "commit": "b150a551b8d465e31e418e1b2eaf5e79bbb7d28e"
  },
  "publicSelectionId": "military",
  "hiddenArchiveId": "military-generation-f27cf981c025cac8",
  "status": "CURRENT",
  "files": [
    {
      "path": "preset.yml",
      "sha256": "423428feb0a6a602cffe552e9c1664ec29d6127d5482a3e11fb94e54803adeff",
      "byteLength": 165
    },
    {
      "path": "agent.cordis.yml",
      "sha256": "c7185bf2b02f3ae39b5bf17350de391e92ccaa588c53da123c859c418727d8af",
      "byteLength": 4034
    }
  ],
  "createdAt": "2026-08-25T04:19:32.988Z",
  "compatibility": {
    "mode": "EXACT_RC2",
    "breaking": true,
    "resumeSupported": true
  }
}
