{
  "schemaVersion": "1.0.0",
  "presetId": "military",
  "generation": "military@sha256:2e76d996d809fde6303a4d190a1e86e9be4d22581346e46e24a4322258217681",
  "assetHash": "2e76d996d809fde6303a4d190a1e86e9be4d22581346e46e24a4322258217681",
  "bundleVersion": "0.9.0-alpha.4",
  "dshBaseline": {
    "release": "0.1.1-rc.2",
    "commit": "b150a551b8d465e31e418e1b2eaf5e79bbb7d28e"
  },
  "publicSelectionId": "military",
  "hiddenArchiveId": "military-generation-2e76d996d809fde6",
  "status": "CURRENT",
  "files": [
    {
      "path": "preset.yml",
      "sha256": "423428feb0a6a602cffe552e9c1664ec29d6127d5482a3e11fb94e54803adeff",
      "byteLength": 165
    },
    {
      "path": "agent.cordis.yml",
      "sha256": "a0849593714662ad2378da60f4cfcf4c6c663d86d79d488ac4bf246bff8b1778",
      "byteLength": 3899
    }
  ],
  "createdAt": "2026-08-24T01:38:10.479Z",
  "compatibility": {
    "mode": "EXACT_RC2",
    "breaking": true,
    "resumeSupported": true
  }
}
